{
  "schemaVersion": "auditbase.audit-result.v1",
  "auditId": "audit-01-example",
  "status": "completed",
  "partial": false,
  "startedAt": "2026-07-14T10:00:00Z",
  "finishedAt": "2026-07-14T10:42:00Z",
  "summary": {
    "title": "Example protocol audit",
    "executiveSummary": "The source-level audit completed with one verified authorization finding. Compilation failed because an external dependency was absent, and that limitation is recorded below.",
    "findingCounts": {
      "critical": 0,
      "high": 1,
      "medium": 0,
      "low": 0,
      "informational": 0
    }
  },
  "findings": [
    {
      "id": "finding-auth-001",
      "title": "Privileged transfer lacks authorization",
      "severity": "high",
      "status": "verified",
      "confidence": "high",
      "category": "access-control",
      "description": "A public entry point reaches the privileged transfer path without checking the caller.",
      "impact": "An arbitrary account can transfer assets held by another account.",
      "recommendation": "Require an authorized role before entering the privileged transfer path.",
      "locations": [
        {
          "path": "contracts/token/Token.sol",
          "startLine": 41,
          "endLine": 48,
          "symbol": "privilegedTransfer",
          "snippet": "function privilegedTransfer(address from, address to, uint256 amount) external"
        }
      ],
      "evidence": [
        {
          "kind": "source",
          "summary": "The external function reaches the balance mutation without a caller check.",
          "location": {
            "path": "contracts/token/Token.sol",
            "startLine": 41,
            "endLine": 48,
            "symbol": "privilegedTransfer"
          }
        }
      ],
      "proof": {
        "status": "not_attempted",
        "summary": "A runnable proof was not possible because the uploaded dependency set was incomplete.",
        "commands": [],
        "artifactPaths": []
      }
    }
  ],
  "coverage": {
    "submittedFileCount": 2,
    "reviewedFileCount": 2,
    "files": [
      {
        "path": "contracts/token/Token.sol",
        "reviewed": true,
        "functionsReviewed": ["privilegedTransfer", "transfer"],
        "notes": []
      },
      {
        "path": "contracts/interfaces/IToken.sol",
        "reviewed": true,
        "functionsReviewed": ["transfer"],
        "notes": []
      }
    ]
  },
  "compilation": {
    "status": "failed",
    "commands": ["forge build"],
    "diagnostics": ["Missing dependency: lib/example-contracts"]
  },
  "limitations": [
    {
      "code": "compilation_failed",
      "message": "Compilation failed because an imported dependency was not uploaded. Codex continued with source-level analysis.",
      "affectedPaths": ["contracts/token/Token.sol"]
    }
  ],
  "usage": {
    "inputTokens": 120000,
    "cachedInputTokens": 80000,
    "outputTokens": 9000,
    "reasoningOutputTokens": 3000,
    "modelRequests": 14,
    "durationMs": 2520000
  }
}
